id,title,authors,date,edition,publisher,isbn-13,language,series,age range,pages,lexile
452,Agile Data Warehousing: Delivering World-Class Business Intelligence Systems Using Scrum and XP,Ralph Hughes,2008/07/14,,"iUniverse, Incorporated",9780595471676,,,,324,
453,Agile Database Techniques: Effective Strategies for the Agile Software Developer,Scott Ambler,2003/10/06,1,Wiley,9780471202837,,,,480,
454,Agro-Ecological Land Resources Assessment for Agricultural Development Planning - A Case of Kenya Resources Data Base and Land Productivity: Technical Annex 6 Fuelwood Productivity,"A.H. Kassam, M. M. Shah, H.T. van Velthuizen, G.W. Fischer, M.M. Shah",1993/12/01,,Food & Agriculture Organization of the United Nations,9789251033968,,World Soil Resources Report Series,,83,
455,"Agro-Ecological Land Resources Assessment for Agricultural Development Planning: A Case Study of Kenya, Resources Data Base and Land Productivity, Technical Annex 5, Livestock Productivity",Associates Bernan (Editor),1993/12/01,,Bernan Associates,9789251033890,,,,91,
456,"AI 2009: Advances in Artificial Intelligence: 22nd Australasian Joint Conference, Melbourne, Australia, December 1-4, 2009, Proceedings","Ann Nicholson (Editor), Xiaodong Li (Editor)",2009/12/01,1,Springer Berlin Heidelberg,9783642104381,,"Lecture Notes in Computer Science / Lecture Notes in Artificial Intelligence Series ,#5866",,688,
457,"AI 2010: Advances in Artificial Intelligence: 23rd Australasian Joint Conference, Adelaide, Australia, December 7-10, 2010. Proceedings",Jiuyong Li (Editor),2011/01/19,1,Springer Berlin Heidelberg,9783642174315,,"Lecture Notes in Computer Science / Lecture Notes in Artificial Intelligence ,#6464",,528,
458,"AI Approaches to the Complexity of Legal Systems - Models and Ethical Challenges for Legal Systems, Legal Language and Legal Ontologies, Argumentation and Software Agents: International Workshop AICOL-III, Held as Part of the 25th IVR Congress, Frankfurt","Monica Palmirani (Editor), Ugo Pagallo (Editor), Pompeu Casanovas (Editor), Giovanni Sartor (Editor)",2012/11/21,1,Springer Berlin Heidelberg,9783642357305,,"Lecture Notes in Computer Science / Lecture Notes in Artificial Intelligence ,#7639",,309,
459,"AI*IA 2013: Advances in Artificial Intelligence: XIIIth International Conference of the Italian Association for Artificial Intelligence, Turin, Italy, December 4-6, 2013, Proceedings","Matteo Baldoni (Editor), Cristina Baroglio (Editor), Guido Boella (Editor), Roberto Micalizio (Editor)",2013/11/30,,Springer International Publishing,9783319035239,,Lecture Notes in Computer Science / Lecture Notes in Artificial Intelligence,,540,
460,"Air Quality Modeling--Theories, Methodologies, Computational Techniques, and Available Databases and Software",Paolo Zannetti (Editor),2003/01/01,,Air & Waste Management Association,9780923204563,,,,,
461,Air-Superfund National Technical Guidance Study Series: Database of Emission Rate Measurement Projects,U.S. Environmental Protection Agency (Created by),2012/09/17,,BiblioGov,9781249419211,,,,122,
462,Ajax in Oracle JDeveloper,Deepak Vohra,2008/04/16,1,Springer Berlin Heidelberg,9783540775959,,,,224,
463,Alaska Geochemical Database: Mineral Exploration Tool for the 21st Century: Open-File Report 2012-1060,"United U.S. Department of the Interior (Created by), et al., Matthew Granitto",2013/01/29,,BiblioGov,9781288676279,,,,40,
464,Algebraic Structures in Automata and Database Theory,B. I. Plotkin,1992/12/28,,"World Scientific Publishing Company, Incorporated",9789810209360,,,,296,
465,"Algorithms and Models for the Web-Graph: 7th International Workshop, WAW 2010, Stanford, CA, USA, December 13-14, 2010, Proceedings","Ravi Kumar (Editor), D Sivakumar (Editor)",2011/03/11,1,Springer Berlin Heidelberg,9783642180088,,"Lecture Notes in Computer Science / Theoretical Computer Science and General Issues ,#6516",,163,
466,Algorithms on Relational Databases,Mirela Catrinel Voicu,2010/08/05,,AV Akademikerverlag GmbH & Co. KG.,9783838392448,,,,188,
467,Aligning Business and IT with Metadata: The Financial Services Way,Hans Wegener,2007/08/31,1,Wiley,9780470030318,,,,310,
468,"Alison Balter's Access 95 Development, with CD-ROM  ",Alison Balter,1996/08/01,,Sams,9780672309441,,Mastering Series,,1006,
469,Alison Balter's Mastering Access 2002 Desktop Development,Alison Balter,2001/08/06,,Sams,9780672321016,,,,1348,
470,Alison Balter's Mastering Access 2002 Enterprise Development,Alison Balter,2002/06/28,,Pearson Education,9780672321139,,,,802,
471,"Alison Balter's Mastering Access 97 Development, Premier Edition, Second Edition",Alison Balter,1997/01/17,2,Sams,9780672309991,,Mastering Series,,1112,
472,Alison Balter's Mastering Microsoft Access 2000 Development,Alison Balter,1999/06/26,,Sams,9780672314841,,Other Sams Series,,1342,
473,Alison Balter's Mastering Microsoft Access 2003,Alison Balter,2003/12/10,,Sams,9780672325502,,,,800,
474,All Consumers Are Not Created Equal: The Differential Marketing Strategy for Brand Loyalty and Profits,"Garth Hallberg, Hallberg, David Oglivy (With)",1995/10/10,1,"Wiley, John & Sons, Incorporated",9780471120049,,,,336,
475,Alphabetic Indexing Rules: Application by Computer  ,Joseph S. Fosegan,2002/10/10,4,Cengage Learning,9780538434720,,,,128,
476,Ambient Diagnostics,Yang Cai,2014/10/13,,Taylor & Francis,9781466510418,,,,404,
477,"American Dragon Jake Long - Database: Characters, Episodes, Agent Brainard, American Dragon, Arthur Spudinski, Aunt Cathy, Avemetrus, Bertha, Blobzill",Source Wikia,2011/11/28,,General Books LLC,9781234743987,,,,102,
478,Amiga Games Database,"Jesse Russell (Editor), Ronald Cohn (Editor)",1941/01/01,,Book on Demand,9785511812342,,,,108,
479,An Accounting Model-Based Approach to Semantic Reconciliation in Heterogeneous Database Systems...,Wang Y. Richard (Yng-Yuh Richard) (Created by),2013/12/13,,HardPress Publishing,9781314742565,,,,44,
480,An Adaptive Database Intrusion Detection System.,Rita M Barrios,2012/10/18,,BiblioLabsII,9781249874744,,,,112,
481,An Advanced Course in Databases Systems: Beyond Relational Databases,"Suzanne W. Dietrich, Susan Urban, Susan D. Urban, Susan D. Urban, Susan Urban",2004/10/22,1,Prentice Hall,9780130428981,,,,470,
482,An Analysis of the Current Development Stage of the eXtensible Markup Language   and its Usage for Database Systems,German Saueressig,2002/09/30,,diplom.de,9783838658889,,,,88,
483,An Analysis on Spatial Database,Ujjwal Gupta,2012/03/07,,CreateSpace Publishing,9781475198317,,,,82,
484,An Approach to Replicated Databases for Robust Command and Control,Iris Kameny,1996/01/31,,Rand Publishing,9780833023384,,,,128,
485,An Elementary Introduction to Data Base Management,James Bradley,1989/02/28,,Dryden Press FL,9780030141447,,,,352,
486,An Evaluation of the M204 Data-Base Management System; Usgs Open-File Report 81-1148,George T. Mason,2013/03/25,,BiblioGov,9781288990085,,,,52,
487,An indexing and classification system for earth-science data bases: USGS Open-File Report 89-47,"et al. (Created by), J. C. Schornick, J. B. Pruitt",2013/03/07,,BiblioGov,9781288870813,,,,64,
488,An Introduction to Database Systems: Relational Model Value Package,C. J. Date,2000/04/20,7,Addison-Wesley,9780201547320,,,,,
489,An Introduction to Database Systems,Chris J. Date,1983/01/28,1,Addison-Wesley,9780201144741,,Systems Programming Series,,480,
490,An Introduction to Databases with Web Applications,Martyn Prigmore,2007/11/22,,"Pearson Education, Limited",9780321263599,,,,712,
491,An Introduction To Duplicate Detection,"Felix Naumann, M. Tamer Özsu (Contribution by), Melanie Herschel",2010/03/12,,Morgan and Claypool Publishers,9781608452200,,Synthesis Lectures on Data Management Series,,88,
492,An Introduction to IMS: Your Complete Guide to IBM Information Management System,"Barbara Klein, Richard Alan Long, Kenneth Ray Blackman, Diane Lynne Goff, Stephen Paul Nathan",2012/03/27,2,IBM Press,9780132886871,,,,567,
493,An Introduction to IMS: Your Complete Guide to IBM's Information Management System,"Dean Meltz, Rick Long, Mark Harrington, Robert Hain, Geoff Nicholls",2011/01/25,,IBM Press,9780132659529,,,,592,
494,An Introduction to XML Query Processing and Keyword Search,Jiaheng Lu,2013/04/30,1,Springer Berlin Heidelberg,9783642345548,,,,291,
495,An R Companion to Applied Regression,"John Fox, Harvey Sanford Weisberg",2010/11/29,2,SAGE Publications,9781412975148,,,,449,
496,An SAB Report: Review of the Source Ranking Database,U.S. Environmental Protection Agency (Created by),2012/09/12,,BiblioGov,9781249346722,,,,38,
497,Analysis and Comparison of Relational Database Systems,"Patrick Valduriez, Georges Gardarin",1990/11/13,,Addison-Wesley,9780201199406,,,,250,
498,Analysis and Design of Stream Ciphers,Rainer A. Rueppel,2012/07/28,,Springer Berlin Heidelberg,9783642828676,,Communications and Control Engineering Series,,244,
499,"Analysis of Images, Social Networks and Texts: Third International Conference, AIST 2014, Yekaterinburg, Russia, April 10-12, 2014, Revised Selected Papers","Dmitry I. Iganov (Editor), Mikhail Khachay (Editor), Alexander Panchenko (Editor), Natalia Konstantinova (Editor), Rostislav Yavorsky (Editor)",2014/12/05,,Springer International Publishing,9783319125794,,Communications in Computer and Information Science Series,,296,
500,Analytic Mapping And Geographic Databases,"Robert S. Biggs, G. David Garson, Robert S. Biggs, Robert S. Biggs (Joint Author)",1992/01/01,,SAGE Publications,9780803947528,,"Quantitative Applications in the Social Sciences ,#87",,100,
501,Analyzing International Environmental Regimes: From Case Study to Database,"Helmut Breitmeier, Oran R. Young, Michael Zurn",2006/09/01,,MIT Press,9780262026024,,Global Environmental Accord,,336,
502,Analyzing Legacy U.S. Geological Survey Geochemical Databases Using GIS? Applications for a National Mineral Resource Assessment,"Douglas B. Yager, Albert H. Hofstra, Matthew Granitto",2014/06/23,,CreateSpace Publishing,9781500297879,,,,34,
503,"Anaphora Processing and Applications: 7th Discourse Anaphora and Anaphor Resolution Colloquium, DAARC 2009 Goa, India, November 5-6, 2009 Proceedings","Lalitha Devi Sobha (Editor), Antonio Branco (Editor), Ruslan Mitkov (Editor)",2009/10/26,1,Springer Berlin Heidelberg,9783642049743,,"Lecture Notes in Computer Science / Lecture Notes in Artificial Intelligence Series ,#5847",,131,
504,Anatomy Ontologies for Bioinformatics: Principles and Practice,"Albert Burger (Editor), Duncan Davidson (Editor), Richard Baldock (Editor)",2007/12/06,1,Springer London,9781846288845,,"Computational Biology Series ,#6",,354,
505,Anonymization views: Supporting privacy in database systems .,Jalaja Padma,2012/05/24,,BiblioLabsII,9781248983942,,,,86,
506,Anwendungsentwicklung mit Datenbanken,"Michael Unterstein, Gunter Matthiessen",2013/12/28,5,Springer Berlin Heidelberg,9783642390029,German,eXamen.press Series,,182,
507,Anwendungsorientiertes DB-Archivieren: Neue Konzepte zur Archivierung in Datenbanksystemen,Axel Herbst,2012/07/31,1,Springer Berlin Heidelberg,9783642645914,German,,,181,
508,Apache Cassandra Hands-On Training Level One,Ruth Stryker,2014/07/23,,CreateSpace Publishing,9781500548391,,,,406,
509,Apache Derby -- Off to the Races: Includes Details of IBM Cloudscap,"Paul C. Zikopoulos, Dan Scott, George Baklarz",2010/06/29,,IBM Press,9780137080175,,,,600,
510,Apache Mahout Cookbook,Piero Giacomelli,2013/09/12,,Packt Publishing,9781849518024,,,,250,
511,"Apache, MySQL, and PHP Web Development All-in-One Desk Reference For Dummies","Jeff Cogswell, David Dalan",2003/12/05,1,Wiley,9780764549694,,For Dummies Series,,760,
512,Apache Openoffice.Org 3.4: Using Base,Prof James Steinberg,2013/09/23,,CreateSpace Independent Publishing Platform,9781492793991,,,,152,
513,Apache Solr High Performance,Surendra Mohan,2014/03/01,,Packt Publishing,9781782164821,,,,124,
514,Apache Sqoop Cookbook,"Kathleen Ting, Jarek Jarcec Cecho",2013/07/15,1,"O'Reilly Media, Incorporated",9781449364625,,,,94,
515,Application Cases in MIS: Using Spreadsheet and Database Software,James N. Morgan,1993/06/28,1,McGraw-Hill Higher Education,9780256133899,,,,130,
516,Application Development with Microsoft Access 2007  ,Alison Balter,2008/12/17,,Sams,9780672330216,,LiveLessons Series,,130,
517,Application of Information Retrieval Techniques to Heterogeneous Databases in the Virtual Distributed Laboratory,Rodney D. Lykins,2012/12/05,,BiblioScholar,9781288405947,,,,96,
518,Application of Unimarc to Multinational Databases,"Bayerische Staatsbibliothek Bayerische Staatsbibliothek Munchen (Editor), Consortium of Consortium of European Research Libraries (Editor), Anthony G. Curven (Compiler), Chris Kirk (Compiler)",1999/09/01,,"Saur, K.G. Verlag Gmbh & Company",9783598114243,,UBCIM Publications. New Series,,140,
519,"Applications of Databases: First International Conference, ADB-94, Vadstena, Sweden, June 1994, Proceedings","Witold Litwin (Editor), Tore Risch (Editor)",1994/07/01,,"Springer-Verlag New York, LLC",9780387581835,,Lecture Notes in Computer Science,,471,
520,Applications of Logic Databases,Raghu Ramakrishnan,1994/11/24,1,Springer US,9780792395331,,"The Springer International Series in Engineering and Computer Science ,#296",,280,
521,Applied Data Mining,"Guandong Xu, Yu Zong, Zhenglu Yang",2013/06/28,,CRC Press,9781466585836,,,,284,
522,Applied Database Logic: Fundamental Database Issues,Barry E. Jacobs,1985/06/28,,Prentice Hall Professional Technical Reference,9780130402059,,Advances in Computing Science and Techno,,272,
523,"Applied Insurance Analytics: A Framework for Driving More Value from Data Assets, Technologies, and Tools",Pat Saporito,2014/08/08,1,Pearson FT Press,9780133760361,,FT Press Analytics Series,,300,
524,Applied Mathematics for Database Professionals,"Lex deHaan, Toon Koppelaars",2007/06/19,1,Apress,9781590597453,,Expert's Voice Series,,376,
525,Applied Microsoft Analysis Services 2005: And Microsoft Business Intelligence Platform,Teo Lachev,2005/10/28,,Prologika,9780976635307,,,,712,
526,Applied Microsoft SQL Server 2008 Reporting Services,Teo Lachev,2008/08/15,,Prologika,9780976635314,,,,768,
527,Applied Microsoft SQL Server 2012 Analysis Services: Tabular Modeling,Teo Lachev,2012/02/16,,Prologika,9780976635352,,,,416,
528,Applying and Extending Oracle Spatial,Simon Gerard Greener,2013/08/12,,Packt Publishing,9781849686365,,,,568,
529,Approach 3 for Windows for Dummies,Doug Lowe,1994/10/01,,"Wiley, John & Sons, Incorporated",9781568842332,,For Dummies Series,,384,
530,Approach 3 for Windows  ,James E. Powell,1994/11/01,,"Wiley, John & Sons, Incorporated",9780782113068,,Mastering Series,,848,
531,Approach 97 For Windows For Dummies,"Deborah S. Ray, Doug Lowe",1997/03/01,1,"Wiley, John & Sons, Incorporated",9780764500015,,For Dummies Series,,384,
532,An Approach to Knowledge Base Management,Nelson M. Mattos,1991/07/30,1,Springer Berlin Heidelberg,9783540542681,,"Lecture Notes in Computer Science / Lecture Notes in Artificial Intelligence Series ,#513",,254,
533,Aquire Aquatic Information Retrieval Toxicity Data Base Project Description Guidelines and Procedures,U.S. Environmental Protection Agency (Created by),2012/09/18,,BiblioGov,9781249433415,,,,188,
534,Arabic Database For Atr Research And Benchmarking,Amin Alhashim,2010/10/15,,VDM Verlag,9783639299441,,,,88,
535,Arabic Information Retrieval,"Kareem Darwish, Walid Magdy",2014/02/28,,Now Publishers,9781601987761,,,,124,
536,Arachne  ,"Jesse Russell (Editor), Ronald Cohn (Editor)",2012/06/26,,Book on Demand,9785512326640,,,,80,
537,Arcgis And Databases,Prasanth Bondalapati,2011/09/30,,AV Akademikerverlag GmbH & Co. KG.,9783846510049,,,,80,
538,Architects of Colorado: Database of State Business Directory Listings 1875-1950,Office of A Colorado Historical Society (Created by),2013/03/07,,BiblioGov,9781288833160,,,,54,
539,The Architectural Logic of Database Systems,E. J. Yannakoudakis,1988/06/01,,"Springer-Verlag New York, LLC",9780387195131,,,,336,
540,Architecture and Methods for Flexible Content Management in Peer-to-Peer Systems,Udo Bartlang,2010/02/24,1,Vieweg+Teubner Verlag,9783834810236,,,,240,
541,"Architecture and Models in Data Base Management: Proceedings of the IFIP-TC-2 Working Conference, 4th, Nice, January, 1977",G. M. Nijssen (Editor),1977/08/01,,Elsevier Science & Technology Books,9780720407587,,,,326,
542,"Architecture and Patterns for IT Service Management, Resource Planning, and Governance: Making Shoes for the Cobbler's Children",Charles T. Betz,2011/10/07,2,Elsevier Science,9780123850171,,,,480,
543,Architecture Of A Database System,"Joseph M Hellerstein, Michael Stonebraker, James Hamilton",2007/09/30,,Now Publishers,9781601980786,,,,136,
544,Archivierung in Datenbanksystemen: Konzept und Sprache,Ralf Schaarschmidt,2001/06/28,1,Vieweg+Teubner Verlag,9783519003250,German,Teubner Reihe Wirtschaftsinformatik Series,,377,
545,Archiving Historic Bird Checklists from Southwest Alaska?s National Parks into eBird and Avian Knowledge Network Databases,Tracey Gotthardt,2013/09/13,,CreateSpace Independent Publishing Platform,9781492359500,,,,78,
546,Archiving Historic Bird Checklists from Southwest Alaska's National Parks into eBird and Avian Knowledge Network Databases,National Park Service (NPS) (Created by),2012/07/19,,BiblioGov,9781249113584,,,,82,
547,Archiving Southwest Alaska?s National Park Bird Survey Data in the Avian Knowledge Network   Database: Project Overview,National Park Service,2013/10/18,,CreateSpace Independent Publishing Platform,9781492931515,,,,32,
548,Archiving Southwest Alaska's National Park Bird Survey Data in the Avian Knowledge Network   Database: Project Overview,National Park Service (NPS) (Created by),2012/09/13,,BiblioGov,9781249378549,,,,36,
549,Art and Humanities Database,"Hedayat Mina, Musa Kahn Sabzali, Ghazali Rosmawati",2014/03/24,,AV Akademikerverlag GmbH & Co. KG.,9783659290886,,,,56,
550,The Art and Science of Oracle Performance Tuning,Christopher Lawson,2003/02/11,,"Wrox Press, Inc.",9781904347019,,Process in Practice Series,,459,
551,The Art of Computer Programming,"Donald E. Knuth, Donald Knuth",1998/04/17,2,Addison-Wesley,9780201896855,,,,780,
552,The Art Of Sql,"Stephane Faroult, Peter Robson",2006/03/17,1,"O'Reilly Media, Incorporated",9780596008949,,,,372,
553,"Artificial Immune Systems: 5th International Conference, ICARIS 2006, Oeiras, Portugal, September 4-6, 2006, Proceedings","Hugues Bersini (Editor), Jorge Carneiro (Editor)",2006/10/05,1,Springer Berlin Heidelberg,9783540377498,,"Lecture Notes in Computer Science / Theoretical Computer Science and General Issues Series ,#4163",,460,
554,"Artificial Immune Systems: Second International Conference, ICARIS 2003, Edinburgh, UK, September 1-3, 2003, Proceedings","Jon Timmis (Editor), Peter Bentley (Editor), Emma Hart (Editor)",2003/09/29,1,Springer Berlin Heidelberg,9783540407669,,"Lecture Notes in Computer Science Series ,#2787",,304,
555,"Artificial Immune Systems: 6th International Conference, ICARIS 2007, Santos, Brazil, August 26-29, 2007, Proceedings","Leandro N. de Castro (Editor), Fernando J. Von Zuben (Editor), Helder Knidel (Editor)",2007/08/28,1,Springer Berlin Heidelberg,9783540739210,,"Lecture Notes in Computer Science / Theoretical Computer Science and General Issues Series ,#4628",,440,
556,"Artificial Immune Systems: 8th International Conference, ICARIS 2009, York, UK, August 9-12, 2009, Proceedings","Paul S. Andrews (Editor), Jon Timmis (Editor), Nick D. L. Owens (Editor), Uwe Aickelin (Editor), Emma Hart (Editor)",2009/07/28,1,Springer Berlin Heidelberg,9783642032455,,"Lecture Notes in Computer Science / Theoretical Computer Science and General Issues Series ,#5666",,343,
557,"Artificial Intelligence and Cognitive Science: 20th Irish Conference, AICS 2009, Dublin, Ireland, August 19-21, 2009, Revised Selected Papers","Lorcan Coyle (Editor), Jill Freyne (Editor)",2011/01/14,1,Springer Berlin Heidelberg,9783642170799,,"Lecture Notes in Computer Science / Lecture Notes in Artificial Intelligence Series ,#6206",,293,
558,"Artificial Intelligence and Computational Intelligence: International Conference, AICI 2009, Shanghai, China, November 7-8, 2009, Proceedings","Hepu Deng (Editor), Lanzhou Wang (Editor), Fu Lee Wang (Editor), Jingsheng Lei (Editor)",2009/10/26,1,Springer Berlin Heidelberg,9783642052521,,"Lecture Notes in Computer Science / Lecture Notes in Artificial Intelligence Series ,#5855",,737,
559,"Artificial Intelligence and Soft Computing: 11th International Conference, ICAISA 2012, Zakopane, Poland, April 29 - 3 May, 2012, Proceedings, Part II","Leszek Rutkowski (Editor), Marcin Korytkowski (Editor), Rafal Scherer (Editor), Ryszard Tadeusiewicz (Editor), Lotfi Zadeh (Editor)",2012/04/19,1,Springer Berlin Heidelberg,9783642293498,,"Lecture Notes in Computer Science / Lecture Notes in Artificial Intelligence Series ,#7268",,720,
560,"Artificial Intelligence and Soft Computing, Part I: 10th International Conference, ICAISC 2010, Zakopane, Poland, June13-17, 2010, Part I","Leszek Rutkowski (Editor), Rafal Scherer (Editor), Ryszard Tadeusiewicz (Editor), Lotfi Zadeh (Editor), Jacek M. Zurada (Editor)",2010/07/21,1,Springer Berlin Heidelberg,9783642132070,,"Lecture Notes in Computer Science / Lecture Notes in Artificial Intelligence Series ,#6113",,710,
561,"Artificial Intelligence and Soft Computing, Part II: 10th International Conference, ICAISC 2010, Zakopane, Poland, June 13-17, 2010, Part II Proceedings","Leszek Rutkowski (Editor), Rafal Scherer (Editor), Ryszard Tadeusiewicz (Editor), Lotfi Zadeh (Editor), Jacek M. Zurada (Editor)",2010/07/21,1,Springer Berlin Heidelberg,9783642132315,,"Lecture Notes in Computer Science / Lecture Notes in Artificial Intelligence Series ,#6114",,711,
562,"Artificial Intelligence Applications and Innovations: 9th IFIP WG 12.5 International Conference, AIAI 2013, Paphos, Cyprus, September 30 -- October 2, 2013, Proceedings","Harris Papadopoulos (Editor), Andreas S. Andreou (Editor), Lazaros S. Iliadis (Editor), Ilias Maglogiannis (Editor)",2013/09/30,,Springer Berlin Heidelberg,9783642411410,,"IFIP Advances in Information and Communication Technology Series ,#412",,709,
563,"Artificial Intelligence in Databases and Information Systems  : Proc. of the Tc2wg2.6 - Tc8wg8.1 Working Conf., Guangzhou, China 4-8 July, 1988","Zhongzhi Shi, R. A. Meersman (Editor), C. H. Kung (Editor)",1990/02/28,,Elsevier Science & Technology Books,9780444886453,,,,584,
564,"Artificial Neural Networks - ICANN 2006: 16th International Conference, Athens, Greece, September 10-14, 2006, Proceedings, Part II","Stefanos Kollias (Editor), Andreas Stafylopatis (Editor), Wlodzislaw Duch (Editor), Erkki Oja (Editor)",2006/10/09,1,Springer Berlin Heidelberg,9783540388715,,"Lecture Notes in Computer Science / Theoretical Computer Science and General Issues Series ,#4132",,1028,
565,"Artificial Neural Networks - ICANN 2010: 20th International Conference, Thessaloniki, Greece, September 15-18, 2010, Proceedings, Part III","Konstantinos Diamantaras (Editor), Wlodek Duch (Editor), Lazaros S. Iliadis (Editor)",2010/09/29,1,Springer Berlin Heidelberg,9783642158247,,"Lecture Notes in Computer Science / Theoretical Computer Science and General Issues Series ,#6354",,575,
566,AS/400 Architecture and Application: The Database Machine,Jill T. Lawrence,1993/01/01,,"Wiley, John & Sons, Incorporated",9780894354342,,,,300,
567,AS/400 Associate System Operator Certification Guide,"Steve Murray, Rochester Community & Technical College (Joint Author)",1999/10/01,,Mc Press,9781583470077,,Certification Study Guide Series,,384,
568,"AS/400: Systems, Utilities, Database and Programming","George Lin, Gayla Stewart",1995/09/28,1,Prentice Hall Professional Technical Reference,9780133820607,,,,640,
569,"ASCII database of principal lode mines and mineralized areas in southern Summit County, Colorado: USGS Open-File Report 91-27-A","Anna B. Wilson, Edward J. LaRock",2013/03/07,,BiblioGov,9781288882373,,,,28,
570,"ASHRAE Duct Fitting Database, Version 5. 00. 00",American Society of Heating (Contribution by),2008/05/12,,"American Society of Heating, Refrigerating & Air-Conditioning Engineers, Incorporated",9781933742380,,,,,
571,"Asian Digital Libraries. Looking Back 10 Years and Forging New Frontiers: 10th International Conference on Asian Digital Libraries, ICADL 2007, Hanoi, Vietnam, December 10-13, 2007. Proceedings","Dion Hoe Lian Goh (Editor), Tru Hoang Cao (Editor), Ingeborg Solvberg (Editor), Edie Rasmussen (Editor)",2007/12/20,1,Springer Berlin Heidelberg,9783540770930,,"Lecture Notes in Computer Science / Information Systems and Applications, incl. Internet/Web, and HCI Series ,#4822",,522,
572,ASP and ADO with Activeperl with CD-ROM,Tobias Martinsson,2000/04/04,1,Wiley,9780471383147,,,,290,
573,ASP .NET Programming with C# & SQL Server,"Don Gosselin, Gosselin",2009/07/27,1,Cengage Learning,9781423903246,,Web Technologies Series,,672,
574,Aspect-Oriented Database Systems,Awais Rashid,2004/02/20,1,Springer Berlin Heidelberg,9783540009481,,,,176,
575,ASPECTS OF DATABASES,"M. S. Jackson, A E. Robinson",1991/08/01,,Elsevier Science & Technology Books,9780750615259,,,,305,
576,Aspects of Natural Language Processing: Essays Dedicated to Leonard Bolc on the Occasion of His 75th Birthday,"Malgorzata Marciniak (Editor), Agnieszka Mykowiecka (Editor)",2009/09/29,1,Springer Berlin Heidelberg,9783642047343,,"Lecture Notes in Computer Science / Information Systems and Applications, incl. Internet/Web, and HCI Series ,#5070",,449,
577,Asp.Net Database Programming Weekend Crash Course with CD-ROM,"Jason Butler, Tony Caudill",2001/12/15,1,"Wiley, John & Sons, Incorporated",9780764548307,,Weekend Crash Course Series,,406,
578,Association Rule Hiding for Data Mining,"Aris Gkoulalas-Divanis, Vassilios S. Verykios",2010/05/28,1,Springer US,9781441965684,,"Advances in Database Systems Series ,#41",,138,
