id,title,authors,date,edition,publisher,isbn-13,language,series,age range,pages,lexile
1020,Computer and Information Sciences II: 26th International Symposium on Computer and Information Sciences,"Erol Gelenbe (Editor), Ricardo Lent (Editor), Georgia Sakellari (Editor)",2014/05/05,,Springer London,9781447158103,,,,586,
1021,"Computer Applications for Database, Education and Ubiquitous Computing: International Conferences, EL, DTA and UNESST 2012, Held as Part of the Future Generation Information Technology Conference, FGIT 2012, Gangneug, Korea, December 16-19, 2012. Proceedi","Tai-hoon Kim (Editor), Jianhua Ma (Editor), Wai-chi Fang (Editor), Yanchun Zhang (Editor), Alfredo Cuzzocrea (Editor)",2012/11/15,1,Springer Berlin Heidelberg,9783642356025,,"Communications in Computer and Information Science Series ,#352",,356,
1022,Computer-Assisted Data Base Design,G. Hubbard,1981/04/01,,"Wiley, John & Sons, Incorporated",9780442233303,,,,248,
1023,Computer-Assisted Data Base Design,George U. Hubbard,1981/07/01,,"Wiley, John & Sons, Incorporated",9780442232054,,Van Nostrand Reinhold Data Processing Series,,248,
1024,Computer Concepts Brief and Microsoft Office 2010 Illustrated Introductory,"David W. Beskeen, Carol M. Cram, Jennifer Duffy, Lisa Friedrichsen",2012/04/12,,Cengage Learning,9781133611585,,,,784,
1025,Computer Data-Base Organization,James Martin,1977/10/05,2,Prentice Hall Professional Technical Reference,9780131654235,,Prentice-Hall Series in Automatic Computation,,712,
1026,Computer Data Management and Data Base Technology,Harry Katzan,1975/04/28,,Van Nostrand Reinhold,9780442242633,,,,347,
1027,Computer Databases,Andrew M. Brown,2013/12/07,,CreateSpace Publishing,9781494259204,,,,56,
1028,Computer Graphics and Chemical Structures: Database Management Systems,Stanley V. Kasparek,1990/01/29,1,"Wiley, John & Sons, Incorporated",9780471628224,,,,798,
1029,"Computer Graphics and Database Management, 1991: Presented at the 1991 Pressure Vessels and Piping Conference, San Diego, California, June 23-27, 1991","James F. Cory, American Society of Mechanical Engineers, Pressure Vessels and Piping Division Staff (Contribution by)",1991/01/01,,American Society of Mechanical Engineers,9780791808030,,,,75,
1030,Computer Literature Searching: Research Strategies and Databases,Charles L. Gilreath,1984/03/01,,Westview Press,9780865315266,,Westview Special Studies in Information Science and Management,,180,
1031,Computer Medical Databases: The First Six Decades  ,Morris F. Collen,2011/10/21,1,Springer London,9780857299611,,Health Informatics Series,,288,
1032,"Computer Music Modeling and Retrieval: Third International Symposium, CMMR 2005, Pisa, Italy, September 26-28, 2005, Revised Papers","Richard Kronland-Martinet (Editor), Thierry Voinier (Editor), Solvi Ystad (Editor)",2006/07/06,1,Springer Berlin Heidelberg,9783540340270,,"Lecture Notes in Computer Science / Information Systems and Applications, incl. Internet/Web, and HCI Series ,#3902",,280,
1033,"Computer Network, Systems, And Database Administrators",Stephen Gladwell,2011/02/16,,Emereo Pty Ltd,9781742449005,,,,88,
1034,Computer Readable Data Bases,Kathleen Y. Marcaccio,1989/12/01,6,Cengage Gale,9780810329447,,,,1350,
1035,"Computer Readable Databases: A Directory and Data SourceBook: Business, Law, Humanities and Social Sciences",M. Williams,1985/01/28,,Elsevier Science,9780444876140,,,,908,
1036,Computer Readable Databases: Directory Data Sourcebook,Marcacciok,1991/11/01,8,Cengage Gale,9780810329461,,,,,
1037,Computer Security: 20 Things Every Employee Should Know,Ben Rothke,2005/08/18,2,McGraw-Hill Professional Publishing,9780072262827,,McGraw-Hill Professional Education Ser.,,45,
1038,Computer Security Lab Manual,"Vincent Nestler, Wm. Arthur Conklin, Gregory White, Matthew Hirsch",2005/06/22,1,McGraw-Hill Higher Education,9780072255089,,Information Assurance and Security Ser.,,320,
1039,Computer Security: Protecting Digital Resources,Robert C Newman,2009/02/19,,Jones & Bartlett Learning,9780763759940,,,,453,
1040,Computer Specialist  ,"Jack Rudman, National Learning Corporation (Editor)",1994/12/28,,National Learning Corporation,9780837328768,,"Career Examination Series ,#2876",,,
1041,Computer Supported Spectroscopic Data Bases,Jure Zupan,1986/11/01,,Prentice Hall Professional Technical Reference,9780470207307,,Analytical Chemistry Ser.,,165,
1042,"Computer Technology: Logic, Memory, and Microprocessors: A Bibliography",A. H. Agajanian,2013/04/30,1,Springer US,9781468460988,,"IFI Data Base Library Series ,#163",,364,
1043,Computerization and Networking of Material Databases,"Satoshi Nishijima, Shuichi Iwata (Editor), Crystal H. Newton (Editor)",1997/01/01,2,American Society for Testing & Materials,9780803124196,,,,315,
1044,Computerization and Networking of Materials Data Bases,"J. S. Glazman (Editor), J. R. Rumble Jr. (Editor)",1989/04/01,,American Society for Testing & Materials,9780803111912,,"Special Technical Publications ,#1017",,360,
1045,Computerization and Networking of Materials Database,"Thomas Barry (Editor), K. Reynard (Editor), Keith Reynard (Editor)",1992/11/01,,American Society for Testing & Materials,9780803114371,,"Special Technical Publications ,#1140",,504,
1046,Computerization and Networking of Materials Databases,"Charles P. Sturrock (Editor), Edwin P. Begley (Editor)",1995/10/28,,American Society for Testing & Materials,9780803120266,,"STP, Special Technical Publication Series ,#1257",,292,
1047,Computerization and Networking of Materials Databases,"J. G. Kaufman (Editor), J. S. Glazman (Editor)",1991/05/01,,American Society for Testing & Materials,9780803114111,,"Special Technical Publications ,#1106",,285,
1048,"Computerized Database of the Optical Properties of the Opaque Minerals: Compiled from Tables for Microscope Identification of Ore Minerals, by Uyten",Joseph F. Whelan,2013/04/02,,BiblioGov,9781287048862,,,,156,
1049,Computerized Metallurgical Databases,J. Cuthill (Editor),1988/01/01,,"TMS (The Minerals, Metals & Materials Society)",9780873390361,,,,,
1050,Computing for Historians: An Introductory Guide,"Evan Mawdsley, Thomas Munck",1993/09/01,1,St. Martin's Press,9780719035487,,,,231,
1051,Computing for Site Managers: Database Techniques,"R. Flowers, Flowers (Other)",1996/06/13,1,"Wiley, John & Sons, Incorporated",9780632039685,,,,224,
1052,Computing in Civil Engineering and Symposium on Data Bases,Louis F. Cohn (Editor),1991/04/01,,American Society of Civil Engineers,9780872628038,,,,948,
1053,Computing with Spatial Trajectories,"Yu Zheng, Xiaofang Zhou",2011/10/01,1,Springer New York,9781461416289,,,,308,
1054,Concepts of Database Management 3rd Ed,"Philip J. Pratt, Joseph J. Adamski",2000/02/28,3,"Course Technology, Inc.",9780619000578,,MIS Series,,294,
1055,"Concepts of Database Management, Fifth Edition","Philip J. Pratt, Joseph J. Adamski, Joseph J. Adamski, Adamski",2004/07/12,5,Cengage Learning,9780619215293,,Available Titles Skills Assessment Manager (SAM) - Office 2007 Series,,440,
1056,Concepts of Database Management -Package,Philip J. Pratt,2008/01/28,,Cengage Learning,9780324818727,,,,,
1057,Concepts of Database Management,"Philip J. Pratt, Joseph J. Adamski",1997/05/28,2,"Course Technology, Inc.",9780760049266,,,,248,
1058,Concepts of Database Management,"Philip J. Pratt, Pratt",1994/01/28,1,Cengage Learning,9780877097792,,,,185,
1059,Conceptual Database Design: An Entity-Relationship Approach,"Carol Batini, Stefano Ceri, Shamkant B. Navathe",1991/08/07,1,Addison-Wesley,9780805302448,,,,470,
1060,"Conceptual Modeling, Databases, and CASE: An Integrated View of Information Systems Development","Peri Loucopoulos, Roberto Zicari",1992/10/28,1,"Wiley, John & Sons, Incorporated",9780471554622,,,,576,
1061,"Conceptual Modeling - ER 2000: 19th International Conference on Conceptual Modeling, Salt Lake City, Utah, USA, October 9-12, 2000 Proceedings","Alberto H.F. Laender (Editor), Stephen W. Liddle (Editor), Veda Storey (Editor)",2000/10/27,1,Springer Berlin Heidelberg,9783540410720,,"Lecture Notes in Computer Science Series ,#1920",,589,
1062,"Conceptual Modeling - ER 2001: 20th International Conference on Conceptual Modeling, Yokohama, Japan, November 27-30, 2001, Proceedings","Hideko S. Kunii (Editor), Sushil Jajodia (Editor), Arne Soelvberg (Editor)",2001/11/28,1,Springer Berlin Heidelberg,9783540428664,,"Lecture Notes in Computer Science Series ,#2224",,633,
1063,"Conceptual Modeling - ER 2002: 21st International Conference on Conceptual Modeling Tampere, Finland, October 7-11, 2002 Proceedings","Stefano Spaccapietra (Editor), Salvatore March (Editor), Yahiko Kambayashi (Editor)",2002/09/25,1,Springer Berlin Heidelberg,9783540442776,,"Lecture Notes in Computer Science Series ,#2503",,484,
1064,"Conceptual Modeling -- ER 2003: 22nd International Conference on Conceptual Modeling, Chicago, IL, USA, October 13-16, 2003, Proceedings","Il-Yeol Song (Editor), Stephen W. Liddle (Editor), Tok Wang Ling (Editor), Peter Scheuermann (Editor)",2003/11/13,1,Springer Berlin Heidelberg,9783540202998,,"Lecture Notes in Computer Science Series ,#2813",,586,
1065,"Conceptual Modeling - ER 2004: 23rd International Conference on Conceptual Modeling, Shanghai, China, November 8-12, 2004. Proceedings","Paolo Atzeni (Editor), Wesley Chu (Editor), Hongjun Lu (Editor), Shuigeng Zhou (Editor), Tok Wang Ling (Editor)",2004/11/23,1,Springer Berlin Heidelberg,9783540237235,,"Lecture Notes in Computer Science Series ,#3288",,874,
1066,"Conceptual Modeling - ER 2005: 24th International Conference on Conceptual Modeling, Klagenfurt, Austria, October 24-28, 2005, Proceedings","Christian Kop (Editor), Heinrich C. Mayr (Editor), John Mylopoulos (Editor), Oscar Pastor (Editor)",2005/11/28,1,Springer Berlin Heidelberg,9783540293897,,"Lecture Notes in Computer Science / Information Systems and Applications, incl. Internet/Web, and HCI Series ,#3716",,504,
1067,"Conceptual Modeling - ER 2006: 25th International Conference on Conceptual Modeling, Tucson, AZ, USA, November 6-9, 2006, Proceedings","David W. Embley, Antoni Olive, Sudha Ram",2007/05/07,1,Springer Berlin Heidelberg,9783540472247,,"Lecture Notes in Computer Science / Information Systems and Applications, incl. Internet/Web, and HCI Series ,#4215",,592,
1068,"Conceptual Modeling - ER 2007: 26th International Conference on Conceptual Modeling, Auckland, New Zealand, November 5-9, 2007, Proceedings","Christine Parent (Editor), Klaus-Dieter Schewe (Editor), Veda C. Storey (Editor), Bernhard Thalheim (Editor)",2007/12/10,1,Springer Berlin Heidelberg,9783540755623,,"Lecture Notes in Computer Science / Information Systems and Applications, incl. Internet/Web, and HCI Series ,#4801",,616,
1069,"Conceptual Modeling - ER 2008: 27th International Conference on Conceptual Modeling, Barcelona, Spain, October 20-24, 2008, Proceedings","Qing Li (Editor), Stefano Spaccapietra (Editor), Eric Yu (Editor), Antoni Olive (Editor)",2008/11/17,1,Springer Berlin Heidelberg,9783540878766,,"Lecture Notes in Computer Science / Information Systems and Applications, incl. Internet/Web, and HCI Series ,#5231",,550,
1070,"Conceptual Modeling - ER '96: 15th International Conference on Conceptual Modeling, Cottbus, Germany, October 7 - 10, 1996. Proceedings.",Bernhard Thalheim (Editor),1996/09/30,1,Springer Berlin Heidelberg,9783540617846,,"Lecture Notes in Computer Science Series ,#1157",,502,
1071,"Conceptual Modeling - ER '97: 16th International Conference on Conceptual Modeling, Los Angeles, CA, USA, November 3-5, 1997. Proceedings","David W. Embley (Editor), Robert C. Goldstein (Editor)",1997/11/26,1,Springer Berlin Heidelberg,9783540636991,,"Lecture Notes in Computer Science Series ,#1331",,484,
1072,"Conceptual Modeling - ER '98: 17th International Conference on Conceptual Modeling, Singapore, November 16-19, 1998, Proceedings","Tok Wang Ling (Editor), Sudha Ram (Editor), Mong Li Lee (Editor)",1999/07/20,1,Springer Berlin Heidelberg,9783540651895,,"Lecture Notes in Computer Science Series ,#1507",,482,
1073,"Conceptual Modeling ER'99: 18th International Conference on Conceptual Modeling Paris, France, November 15-18, 1999 Proceedings","Jacky Akoka (Editor), Mokrane Bouzeghoub (Editor), Isabelle Comyn-Wattiau (Editor), Elisabeth Metais (Editor)",1999/12/10,1,Springer Berlin Heidelberg,9783540666868,,"Lecture Notes in Computer Science Series ,#1728",,546,
1074,"Conceptual Modeling for New Information Systems Technologies: ER 2001 Workshops, HUMACS, DASWIS, ECOMO, and DAMA, Yokohama Japan, November 27-30, 2001. Revised Papers","Hiroshi Arisawa (Editor), Yahiko Kambayashi (Editor)",2002/11/11,1,Springer Berlin Heidelberg,9783540441229,,"Lecture Notes in Computer Science Series ,#2465",,502,
1075,"Conceptual Modeling for Novel Application Domains: ER 2003 Workshops ECOMO, IWCMQ, AOIS, and XSDM, Chicago, IL, USA, October 13, 2003, Proceedings","Manfred A. Jeusfeld (Editor), Oscar Pastor (Editor)",2003/11/13,1,Springer Berlin Heidelberg,9783540202578,,"Lecture Notes in Computer Science Series ,#2814",,414,
1076,Conceptual Modeling for Traditional and Spatio-Temporal Applications: The MADS Approach,"Christine Parent, Stefano Spaccapietra, Esteban Zimanyi",2010/11/09,1,Springer Berlin Heidelberg,9783642067648,,,,466,
1077,Conceptual Modeling for XML Vol. 99: Dissertations in Database and Information Systems,M. Necasky,2008/12/15,,"I O S Press, Incorporated",9781586039561,,,,164,
1078,Conceptual Models and Outcomes of Advancing Knowledge Management,Murray E. Jennex,2012/01/31,,IGI Global,9781466600355,,,,436,
1079,Conceptual Schema and Relational Database Design,"S. M. Nijssen, T A. Halpin",1990/11/13,,Prentice Hall Professional Technical Reference,9780131672635,,,,364,
1080,Conceptual Schema and Relational Database Design,Terry A. Halpin,1995/05/01,2,Prentice Hall Professional Technical Reference,9780133557022,,,,547,
1081,Concise Guide to Databases: A Practical Introduction,"Peter Lake, Paul Crowther",2013/12/31,,Springer London,9781447156000,,Undergraduate Topics in Computer Science Series,,307,
1082,The Concordance Database Manual,"Alan Haley, Jim Sumser (Editor)",2006/08/01,1,Apress,9781590596036,,Expert's Voice Series,,392,
1083,"Concurrency 88: International Conference on Concurrency Hamburg, FRG, October 18-19, 1988. Proceedings",Friedrich H. Vogt (Editor),1988/11/14,1,Springer Berlin Heidelberg,9783540504030,,"Lecture Notes in Computer Science Series ,#335",,404,
1084,Concurrency Control and Recovery in Database Systems,Philip Bernstein,1987/04/28,1,Addison-Wesley,9780201107159,,,,383,
1085,Concurrency Control in Distributed Database Systems,"Wojciech Cellary, Erol Gelenbe, T. Morzy",1988/05/01,,Elsevier Science & Technology Books,9780444704092,,Studies in Computer Science and Artificial Intelligence,,350,
1086,Concurrency Control Problem for Database Systems,Marco Antonio Casanova,1981/08/28,,"Springer-Verlag New York, LLC",9780387108452,,Lecture Notes in Computer Science,,175,
1087,Concurrency in Programming and Database Systems,"Arthur J. Bernstein, Philip M. Lewis",1993/01/15,1,Jones & Barlett Learning,9780867202052,,Computer Science-Math Series,,400,
1088,"Concurrent Systems: Operating Systems, Database and Distributed Systems - An Integrated Approach",Jean Bacon,1997/12/16,2,Benjamin-Cummings Publishing Company,9780201177671,,International Computer Science Series,,752,
1089,"Configuration Management 100 Success Secrets - Covering Cm Software,Jobs,Plans,Tools,Control,Database,Process And Systems",Gerard Blokdijk,2008/01/17,,Emereo Pty Ltd,9780980471625,,,,184,
1090,"Configuration Management Best Practice Handbook: Building, Running and Managing a Configuration Management Data Base, CMDB - Ready to use supporting documents bringing ITIL Theory into Practice","Gerard Blokdijk, Ivanka Menken",2008/10/28,,Emereo Pty Ltd,9781921523779,,,,140,
1091,Configuration Management with Chef-Solo,Naveed ur Rahman,2014/07/15,,Packt Publishing,9781783982462,,,,116,
1092,"Configurator Database Report 2013, B/W Edition","Paul Blazek, Martina Partl, Clarissa Streichsbier",2014/01/13,,Lulu.com,9781291676341,,,,352,
1093,Configurator Database Report 2014,"Paul Blazek, Martina Partl, Clarissa Streichsbier",2014/07/07,,Lulu.com,9781291894127,,,,312,
1094,Configuring and Tuning Databases on the Solaris Platform,"Allan N. Packer, Sun Microsystems Press Staff",2001/11/28,1,Prentice Hall,9780130834171,,Solaris Series,,552,
1095,Configuring SAP ERP Financial and Controlling,Peter Jones,2009/03/30,1,Wiley,9780470423288,,,,960,
1096,"Conodont Database and Analysis of Conodont Color Alteration Patterns in the Las Vegas 30 x 60 Quadrangle, Clark and Nye Counties, Nevada, and Inyo County, California: USGS Open-File Report 2005-1343","United U.S. Department of the Interior (Created by), et al., Anita G. Harris",2013/02/06,,BiblioGov,9781288724079,,,,42,
1097,Consolidation in the Data Center: Simplifying IT Environments to Reduce Total Cost of Ownership,"David Hornby, Bill Walker, Ken Pepple (Joint Author)",2002/09/23,1,Prentice Hall,9780130454959,,Blueprint Series,,240,
1098,"Constrained Clustering: Advances in Algorithms, Theory, and Applications","Sugato Basu (Editor), Ian Davidson (Editor), Kiri Wagstaff (Editor)",2008/08/25,,Taylor & Francis,9781584889960,,Chapman & Hall/CRC Data Mining and Knowledge Discovery Series,,472,
1099,"Constraint-Based Mining and Inductive Databases: European Workshop on Inductive Databases and Constraint Based Mining, Hinterzarten, Germany, March 11-13, 2004, Revised Selected Papers","Jean-Francois Boulicaut (Editor), Luc De Raedt (Editor), Heikki Mannila (Editor)",2006/03/16,1,Springer Berlin Heidelberg,9783540313311,,"Lecture Notes in Computer Science / Lecture Notes in Artificial Intelligence Series ,#3848",,404,
1100,"Constraint Databases and Applications: First International Symposium, CDB 2004, Paris, France, June 12-13, 2004, Proceedings","Bart Kuijpers (Editor), Peter Revesz (Editor)",2004/07/27,1,Springer Berlin Heidelberg,9783540221265,,"Lecture Notes in Computer Science Series ,#3074",,184,
1101,"Constraint Databases and Applications: ESPRIT WG CONTESSA Workshop, Friedrichshafen, Germany, September, 8 - 9, 1995. Proceedings","Gabriel Kuper (Editor), Mark Wallace (Editor)",1996/03/05,1,Springer Berlin Heidelberg,9783540607946,,"Lecture Notes in Computer Science Series ,#1034",,192,
1102,"Constraint Databases and Applications: Second International Workshop on Constraint Database Systems, CDB '97, Delphi, Greece, January 11-12, 1997, CP'96 Workshop on Constraints and Databases, Cambridge, MA, USA, August 19, 1996, Selected papers","Volker Gaede (Editor), Alexander Brodsky (Editor), Oliver Gunther (Editor), Divesh Srivastava (Editor), Victor Vianu (Editor)",1997/02/14,1,Springer Berlin Heidelberg,9783540625018,,"Lecture Notes in Computer Science Series ,#1191",,350,
1103,Constraint Databases,"Gabriel Kuper (Editor), Leonid Libkin (Editor), Jan Paredaens (Editor)",2000/05/25,1,Springer Berlin Heidelberg,9783540661511,,,,428,
1104,Constraints and Databases,"Raghu Ramakrishnan (Editor), Peter Stuckey (Editor)",1997/12/31,1,Springer US,9780792380450,,,,192,
1105,"Constructing Data Warehouses with Metadata-Driven Generic Operators, and More: Architecture, Methodology, and Paradigm Concepts, Algorithms, and Opera","Bin Jiang, Bill Inmon (Prologue by)",2012/01/28,,CreateSpace Publishing,9781469956299,,,,366,
1106,"Constructing Data Warehouses with Metadata-Driven Generic Operators, and More: Architecture, Methodoloy, and Paradigm; Concepts, Algorithms, and Opera",Bin Jiang,2011/07/28,,DBJ Publishing,9783033029200,,,,366,
1107,"Construction Information Database Framework   For Integrated Cost, Schedule, And Performance Control.",Melissa Michelle Donegan,2011/09/08,,BiblioLabsII,9781243727183,,,,486,
1108,Consumer Expenditure in Interwar Belgium: The Reconstruction of a Database,"Chris Schroeven, C. Schroeven",1995/01/01,,Cornell University Press,9789061866596,,Studies In Social And Economic History,,284,
1109,Contemporary Database Marketing Concepts and Applications,"Martin Baier, Kurtis M. Ruf, Goutam Chakraborty, Thomas Stonebeck (Preface by), K. M. Ruf",2002/01/28,1,Racom Communications,9780970451514,,,,320,
1110,Contemporary Issues In Database Design And Information Systems Development,Keng Siau,2007/04/30,,IGI Global,9781599042893,,Advances in Database Research Series,,344,
1111,Content-based management of image databases in the Internet Age.,James Theodore Kleban,2011/10/01,,BiblioLabsII,9781244726796,,,,274,
1112,Content-Based Management of Multimedia Databases,"Serkan Kiranyaz, Moncef Gabbouj",2012/04/27,,AV Akademikerverlag GmbH & Co. KG.,9783848485604,,,,308,
1113,"Content-based retrieval of music using monophonic queries on a database of polyphonic, MIDI information.",Ravikumar Nidadavolu,2012/05/04,,BiblioLabsII,9781248962817,,,,74,
1114,Content-Based Video Retrieval: A Database Perspective,"Johan Janssens, Michiel Steyaert, Alan Neaigus",2002/01/31,1,Springer US,9780792376378,,"The Springer International Series in Engineering and Computer Science ,#661",,142,
1115,Content-Based Video Retrieval: A Database Perspective,"Milan Petkovic, Willem Jonker",2003/10/31,1,Springer US,9781402076176,,"Multimedia Systems and Applications Series ,#25",,168,
1116,Content Evaluation of Textual CD-ROM and Web Databases,"Peter Jacso, Carol Tenopir, Carol Tenopir (Editor), Carol Tenopir (Editor)",2001/10/15,1,Libraries Unlimited,9781563087370,,Database Searching Series,,275,
1117,Content Management Bible,Bob Boiko,2004/10/28,2,Wiley,9780764573712,,"Bible Series ,#349",,1176,
1118,Content Management,Kevin Roebuck,2011/05/26,,Emereo Pty Ltd,9781743043578,,,,484,
1119,"Contents of US EPA Treatability Database as of September 30, 1987",U.S. Environmental Protection Agency (Created by),2012/09/28,,BiblioGov,9781249563815,,,,346,
1120,Contextual Search: A Computational Framework,Massimo Melucci,2012/10/08,,Now Publishers,9781601986009,,,,166,
1121,Continuous Media Databases,"Aidong Zhang (Editor), Avi Silberschatz, Sharad Mehrotra",2000/05/31,1,Springer US,9780792378181,,,,155,
1122,Control in a Data Base Environment,William Perry,1980/01/01,,"Wiley, John & Sons, Incorporated",9780894350429,,"Data Base Monographs ,#10",,91,
1123,Control Measure Evaluations: The Control Measure Data Base for the National Emission Trends inventory: Draft Report,U.S. Environmental Protection Agency (Created by),2012/09/28,,BiblioGov,9781249565819,,,,154,
1124,"Controlled Natural Language: Workshop on Controlled Natural Language, CNL 2009, Marettimo Island, Italy, June 8-10, 2009, Revised Papers",Norbert E Fuchs (Editor),2010/07/28,1,Springer Berlin Heidelberg,9783642144172,,"Lecture Notes in Computer Science / Lecture Notes in Artificial Intelligence Series ,#5972",,291,
1125,Controversial Ohio Database Searches Of Joe Wurzelbacher,Jerold Angelus (Editor),2011/12/27,,International Book Marketing Service Ltd,9786200159588,,,,84,
1126,"Conversion of Environmental Data to a Digital-Spatial Database, Puget Sound Area, Washington: USGS Open-File Report 95-359","United U.S. Department of the Interior (Created by), M. A. Uhrich, T. S. McGrath",2013/02/22,,BiblioGov,9781288795864,,,,122,
1127,Conversion of the Radiometric Age Data Bank   to the National Geochronological Data Base  : Usgs Open-File Report 93-336,Brian D. Marshall,2013/03/20,,BiblioGov,9781288960439,,,,80,
1128,Cool Infographics: Effective Communication with Data Visualization and Design,Randy Krum,2013/10/28,1,Wiley,9781118582305,,,,368,
1129,Cooperation in Classification and Data Analysis: Proceedings of Two German-Japanese Workshops,"Akinori Okada (Editor), Tadashi Imaizumi (Editor), Hans-Hermann Bock (Editor), Wolfgang Gaul (Editor)",2009/07/01,1,Springer Berlin Heidelberg,9783642006678,,"Studies in Classification, Data Analysis, and Knowledge Organization Series",,208,
1130,Cooperative Control,Jeff Shamma (Editor),2008/03/07,1,Wiley,9780470060315,,,,452,
1131,"Cooperative Information Agents: First International Workshop, CIA'97, Kiel, Germany, February 26-28, 1997, Proceedings","Peter Kandzia (Editor), Matthias Klusch (Editor)",1997/03/21,1,Springer Berlin Heidelberg,9783540625919,,"Lecture Notes in Computer Science / Lecture Notes in Artificial Intelligence Series ,#1202",,292,
1132,"Cooperative Information Agents XII: 12th International Workshop, CIA 2008, Prague, Czech Republic, September 10-12, 2008, Proceedings","Matthias Klusch (Editor), Michal Pechoucek (Editor), Axel Polleres (Editor)",2008/09/28,1,Springer Berlin Heidelberg,9783540858331,,"Lecture Notes in Computer Science / Lecture Notes in Artificial Intelligence Series ,#5180",,321,
1133,"Cooperative Information Systems: 9th International Conference, CoopIS 2001, Trento, Italy, September 5-7, 2001. Proceedings","Carlo Batini (Editor), Fausto Giunchiglia (Editor), Paolo Giorgini (Editor), Massimo Mecella (Editor)",2001/10/16,1,Springer Berlin Heidelberg,9783540425243,,"Lecture Notes in Computer Science Series ,#2172",,461,
1134,"Cooperative Information Systems: 7th International Conference, CoopIS 2000 Eilat, Israel, September 6-8, 2000 Proceedings","Opher Etzion (Editor), Peter Scheuermann (Editor)",2000/10/02,1,Springer Berlin Heidelberg,9783540410218,,"Lecture Notes in Computer Science Series ,#1901",,340,
1135,Cooperative Intersection Collision Avoidance System for Violations   - Database Structure,"Raman Sampath, Jonathan Koopmann, Wassim G. Najm",2011/07/31,,CreateSpace Independent Publishing Platform,9781495241031,,,,34,
1136,Cooperative Work and Coordinative Practices: Contributions to the Conceptual Foundations of Computer-Supported Cooperative Work  ,Kjeld Schmidt,2011/02/09,1,Springer London,9781848000674,,Computer Supported Cooperative Work Series,,472,
1137,Coordinated Needs Management Strategy   Technical Reference: Database User's Guide,"U.S. Department of Homeland Security, Federal Emergency Management Agency",2013/09/28,,CreateSpace Independent Publishing Platform,9781492840756,,,,108,
