id,title,authors,date,edition,publisher,isbn-13,language,series,age range,pages,lexile
1432,"Data Security and Security Data: 27th British National Conference on Databases, BNCOD 27, Dundee, UK, June 29 - July 1, 2010. Revised Selected Papers",Lachlan  MacKinnon (Editor),2012/03/11,1,Springer Berlin Heidelberg,9783642257032,,"Lecture Notes in Computer Science / Information Systems and Applications, incl. Internet/Web, and HCI ,#6121",,155,
1433,Data Source Handbook,Pete Warden,2011/03/07,1,"O'Reilly Media, Incorporated",9781449303143,,,,42,
1434,Data Storage Management : A Systems Approach,The Open Group,1997/05/09,,Pearson Education,9780138901875,,,,196,
1435,Data Strategy,"Sid Adelman, Larissa Moss, Majid Abai, Larissa Moss",2005/10/28,1,Addison-Wesley,9780321240996,,,,342,
1436,Data Streams: Models and Algorithms,Charu C. Aggarwal (Editor),2006/11/27,1,Springer US,9780387287591,,"Advances in Database Systems Series ,#31",,354,
1437,Data Structures and Other Objects Using C++,"Michael Main, Walter Savitch",2010/03/10,4,Prentice Hall,9780132129480,,,,848,
1438,Data Structures and Other Objects Using Java,Michael Main,2011/11/16,4,Prentice Hall,9780132576246,,,,848,
1439,"Data Structures, Files and Databases  ","Carl Bamford, Paul Curran",1993/08/04,,"Macmilan Publishing Company, Incorporated",9780333560433,,Computer Science Series,,262,
1440,"Data Tables for the 1993 National Transit Database, Section 15 Report Year",De Federal Transit Administration (FTA) (Created by),2012/07/02,,BiblioGov,9781249001089,,,,406,
1441,Data Tables for the 1995 National Transit Database Report Year,De Federal Transit Administration (FTA) (Created by),2012/07/02,,BiblioGov,9781249001041,,,,504,
1442,Data Types and Persistence,"Malcolm P. Atkinson (Editor), Peter Buneman (Editor), Ronald Morrison (Editor)",1988/06/24,1,Springer Berlin Heidelberg,9783540187851,,Topics in Information Systems Series,,294,
1443,Data Visualization: Principles and Practice,Alexandru C. Telea,2007/12/15,,Taylor & Francis,9781568813066,,,,460,
1444,Data Visualization: A Successful Design Process,Andy Kirk,2012/09/04,,Packt Publishing,9781849693462,,,,206,
1445,Data Visualization For Dummies,"Mico Yuk, Stephanie Diamond",2014/01/28,1,Wiley,9781118502891,,For Dummies Series,,256,
1446,Data Visualization: The State of the Art,"Frits H. Post (Editor), Gregory Nielson (Editor), Georges-Pierre Bonneau (Editor)",2013/04/30,1,Springer US,9781461354307,,"The Springer International Series in Engineering and Computer Science ,#713",,453,
1447,"Data Visualization, Part 2: New Directions for Evaluation, Number 140","Tarek Azzam (Editor), Stephanie Evergreen (Editor)",2013/12/31,1,Wiley,9781118833544,,J-B PE Single Issue (Program) Evaluation Series,,96,
1448,"Data Visualization: Part 1, New Directions for Evaluation, Number 139","Tarek Azzam (Editor), Stephanie Evergreen (Editor)",2013/10/07,1,Wiley,9781118793411,,J-B PE Single Issue (Program) Evaluation Series,,96,
1449,Data Visualization Techniques,"Chandrajit Bajaj (Editor), Bala Krishnamurthy, Bala Krishnamurthy",1999/06/01,1,"Wiley, John & Sons, Incorporated",9780471963561,,Trends in Software Series,,156,
1450,Data Visualization with d3.js,Swizec Teller,2013/09/12,,Packt Publishing,9781782160007,,,,194,
1451,Data Warehouse Design Solutions,"Christopher Adamson, Michael Venerable",1998/07/13,1,Wiley,9780471251958,,,,544,
1452,Data Warehouse Designs: Achieving ROI with Market Basket Analysis and Time Variance,Fon Silvers,2012/01/04,,Taylor & Francis,9781439870761,,,,296,
1453,"Data Warehouse ETL Toolkit: Practical Techniques for Extracting, Cleaning, Conforming, and Delivering Data","Ralph Kimball, Joe Caserta",2004/10/28,1,Wiley,9780764567575,,,,528,
1454,Data Warehouse : Practical Advice from the Experts,"Joyce Bischoff, Ted Alexander",1997/04/17,1,Pearson,9780135773703,,,,428,
1455,Data Warehouse Performance,"William H. Inmon, Ryan Sousa, Chris Buss, Ken Rudin",1998/10/30,1,"Wiley, John & Sons, Incorporated",9780471298083,,,,444,
1456,Data Warehouse Project Management,"Sid Adelman, Larissa Terpeluk Moss (Joint Author), Larissa T. Moss",2000/09/14,1,Addison-Wesley,9780201616354,,Addison-Wesley Information Technology Series,,448,
1457,Data Warehouse Systems: Design and Implementation,"Alejandro Vaisman, Esteban Zimanyi",2014/10/14,,Springer Berlin Heidelberg,9783642546549,,Data-Centric Systems and Applications Series,,625,
1458,The Data Warehouse Toolkit: Practical Techniques for Building Dimensional Data Warehouses  ,"Ralph Kimball, W. H. Inmon (Foreword by)",1996/01/28,1,"Wiley, John & Sons, Incorporated",9780471153375,,,,416,
1459,"Data Warehouses and OLAP: Concepts, Architectures and Solutions","Wrembel, Christian Koncilia (Editor)",2006/10/15,,IGI Global,9781599043647,,,,362,
1460,Data Warehousing 101: Concepts and Implementation,Arshad Khan,2003/08/28,,"iUniverse, Incorporated",9780595290697,,,,136,
1461,Data Warehousing And Business Intelligence For e-Commerce,"Alan R. Simon, Steven L. Shaffer",2001/05/01,1,Elsevier Science,9781558607132,,Morgan Kaufmann Series in Data Management Systems Series,,320,
1462,Data Warehousing and Data Mining Techniques for Cyber Security,Anoop Singhal,2006/12/13,1,Springer US,9780387264097,,"Advances in Information Security Series ,#31",,159,
1463,"Data Warehousing and Knowledge Discovery: 8th International Conference, DaWaK 2006, Krakow, Poland, September 4-8, 2006, Proceedings","A Min Tjoa (Editor), Juan Trujillo (Editor)",2006/10/05,1,Springer Berlin Heidelberg,9783540377368,,"Lecture Notes in Computer Science / Information Systems and Applications, incl. Internet/Web, and HCI Series ,#4081",,582,
1464,"Data Warehousing and Knowledge Discovery: 14th International Conference, DaWaK 2012, Vienna, Austria, September 3-6, 2012, Proceedings","Alfredo Cuzzocrea (Editor), Umeshwar Dayal (Editor)",2012/07/20,1,Springer Berlin Heidelberg,9783642325830,,"Lecture Notes in Computer Science / Information Systems and Applications, incl. Internet/Web, and HCI Series ,#7448",,470,
1465,"Data Warehousing and Knowledge Discovery: 9th International Conference, DaWaK 2007, Regensburg, Germany, September 3-7, 2007, Proceedings","Il Yeol Song (Editor), Johann Eder (Editor), Tho Manh Nguyen (Editor)",2007/08/28,1,Springer Berlin Heidelberg,9783540745525,,"Lecture Notes in Computer Science / Information Systems and Applications, incl. Internet/Web, and HCI Series ,#4654",,484,
1466,"Data Warehousing and Knowledge Discovery: 10th International Conference, DaWak 2008 Turin, Italy, September 1-5, 2008, Proceedings","Il-Yeol Song (Editor), Johann Eder (Editor), Tho Manh Nguyen (Editor)",2008/09/28,1,Springer Berlin Heidelberg,9783540858355,,"Lecture Notes in Computer Science / Information Systems and Applications, incl. Internet/Web, and HCI Series ,#5182",,434,
1467,"Data Warehousing and Knowledge Discovery: 15th International Conference, DaWaK 2013, Prague, Czech Republic, August 26-29, 2013, Proceedings","Ladjel Bellatreche (Editor), Mukesh K. Mohania (Editor)",2013/08/07,,Springer Berlin Heidelberg,9783642401305,,"Lecture Notes in Computer Science / Information Systems and Applications, incl. Internet/Web, and HCI Series ,#8057",,340,
1468,"Data Warehousing and Knowledge Discovery: 11th International Conference, DaWaK 2009 Linz, Austria, August 31-September 2, 2009 Proceedings","Mukesh K. Mohania (Editor), A Min Tjoa (Editor)",2009/09/01,1,Springer Berlin Heidelberg,9783642037290,,"Lecture Notes in Computer Science / Information Systems and Applications, incl. Internet/Web, and HCI Series ,#5691",,480,
1469,"Data Warehousing and Knowledge Discovery: First International Conference, DaWaK'99 Florence, Italy, August 30 - September 1, 1999 Proceedings","Mukesh Mohania (Editor), A Min Tjoa (Editor)",1999/09/24,1,Springer Berlin Heidelberg,9783540664581,,"Lecture Notes in Computer Science Series ,#1676",,408,
1470,"Data Warehousing and Knowledge Discovery: 4th International Conference, DaWaK 2002, Aix-en-Provence, France, September 4-6, 2002. Proceedings","Yahiko Kambayashi (Editor), Werner Winiwarter (Editor), Masatoshi Arikawa (Editor)",2002/10/03,1,Springer Berlin Heidelberg,9783540441236,,"Lecture Notes in Computer Science Series ,#2454",,339,
1471,Data Warehousing and the Management Accountant,"Ian Cobb, Mary Vicki Cobb",2001/06/15,,Elsevier Science,9781859714904,,CIMA Research Series,,40,
1472,"Data Warehousing, Data Mining, and Olap","Alex Berson, Stephen J. Smith",1997/11/01,1,"McGraw-Hill Companies, The",9780070062726,,Series on Data Warehousing and Data Mana,,612,
1473,Data Warehousing Design And Advanced Engineering Applications,Ladjel Bellatreche,2011/03/25,,IGI Global,9781605667560,,Advances in Data Warehousing and Mining (ADWM) Book Series,,338,
1474,Data Warehousing Essentials,Sudhir Warier,2011/05/26,,CreateSpace Publishing,9781463590482,,,,134,
1475,Data Warehousing For Dummies,Alan R. Simon,1997/11/13,1,Wiley,9780764501708,,For Dummies Series,,360,
1476,Data Warehousing For Dummies,Thomas C. Hammergren,2009/03/03,2,Wiley,9780470407479,,For Dummies Series,,384,
1477,Data Warehousing Fundamentals for IT Professionals,Paulraj Ponniah,2010/05/24,2,Wiley,9780470462072,,,,600,
1478,Data Warehousing Fundamentals: A Comprehensive Guide for IT Professionals,"Paulraj Ponniah, Ponniah, Pratap P. Reddy (Foreword by)",2001/08/28,1,"Wiley, John & Sons, Incorporated",9780471412540,,,,544,
1479,Data Warehousing Handbook,Rob Mattison,2006/09/28,,Lulu.com,9781847286659,,,,444,
1480,Data Warehousing in Action,Sean Kelly,1997/08/25,1,Wiley,9780471966401,,,,334,
1481,Data Warehousing,Reema Thareja,2009/06/15,,"Oxford University Press, USA",9780195699616,,,,456,
1482,Data Warehousing: The Ultimate Guide to Building Corporate Business Intelligence,"SCN Education B.V. (Editor), Scn Education Bv (Editor)",2001/04/27,1,"Springer-Verlag New York, LLC",9783528057534,,HOTT Guide Series,,336,
1483,Data Warehousing: The Route to Mass Communication,Sean Kelly,1996/11/15,1,Wiley,9780471963288,,,,228,
1484,"Data Warehousing Strategie: Erfahrungen, Methoden, Visionen","Reinhard Jung (Editor), Robert Winter (Editor)",2000/09/05,1,Springer Berlin Heidelberg,9783540673088,German,Business Engineering Series,,284,
1485,Data Warehousing Technologics for Students,Dr Ashwin I. Mehta,2014/07/23,,Arizona Business Alliance LLC,9781619030275,,,,162,
1486,Data Warehousing with Microsoft SQL Server 7.0: Technical Reference,Jake Sturm,2000/03/01,1,Microsoft Press,9780735608597,,Microsoft Technical Series,,500,
1487,Database 101: Database Primer,Guy Kawasaki,1995/04/28,,Peachpit Press,9780938151524,,,,176,
1488,Database 5 for Windows Programming for Dummies,"James Coombs, Ted Coombs",1994/11/01,,"Wiley, John & Sons, Incorporated",9781568842158,,For Dummies Series,,416,
1489,Database Access Control,Philip Masser,2010/12/24,,VDM Verlag,9783639318197,,,,84,
1490,Database Access with Visual Basic 5.X,"Jeffrey P. McManus, Jeffrey MacManus",1997/11/14,,Que,9781562765675,,,,736,
1491,Database Access with Visual Basic .NET,"Jeffrey P. McManus, Jackie Goldstein",2002/10/04,3,Addison-Wesley,9780672323430,,,,464,
1492,Database Activities to Build Social Studies Skills,John Steffe,1996/09/01,1,"Course Technology, Inc.",9780538665681,,Df - Computer Applications Series,,107,
1493,Database Activity Monitoring,"Frederic P. Miller (Editor), Agnes F. Vandome (Editor), John McBrewster (Editor)",2011/01/21,,Alphascript Publishing,9786134234702,,,,72,
1494,Database administration and automation,Carleton Olegario M ximo (Editor),2012/05/09,,International Book Marketing Service Ltd,9786136557441,,,,120,
1495,Database Administration: The Complete Guide to Practices and Procedures,Craig S. Mullins,2002/06/28,,Addison-Wesley,9780201741292,,,,703,
1496,Database Administration: The Complete Guide to DBA Practices and Procedures,Craig S. Mullins,2012/10/25,2,Addison-Wesley,9780321822949,,,,890,
1497,Database Administration,Kevin Roebuck,2011/06/10,,Emereo Pty Ltd,9781743045688,,,,370,
1498,Database Administrator 65 Success Secrets - 65 Most Asked Questions on Database Administrator - What You Need to Know,Helen Goff,2013/07/24,,Emereo Pty Ltd,9781488524073,,,,118,
1499,Database Administrator - How To Land A Top-Paying Job,Brad Andrews,2009/10/23,,Emereo Pty Ltd,9781742442105,,,,148,
1500,Database Aesthetics: Art In The Age Of Information Overflow,Victoria Vesna (Editor),2007/08/22,8,University of Minnesota Press,9780816641185,,Electronic Mediations Series,,336,
1501,Database Analysis and Design,Hugh Robinson,1989/10/28,2,Krieger Publishing Company,9780862382322,,,,372,
1502,Database Analysis and Design,I. T. Hawryszkiewycz,1984/01/01,,Science Research Associates,9780574214850,,,,578,
1503,Database Analysis and Design,"Igor T. Hawryszkiewycz, I. T. Hawryszkiewycz",1991/03/28,2,Prentice Hall,9780023518515,,,,574,
1504,"Database and Application Security XV: IFIP TC11 / WG11.3 Fifteenth Annual Working Conference on Database and Application Security July 15-18, 2001, Niagara on the Lake, Ontario, Canada","Martin S. Olivier (Editor), David L. Spooner (Editor)",2002/04/30,1,Springer US,9781402070419,,"IFIP Advances in Information and Communication Technology Series ,#87",,346,
1505,Database and Collections of Information Misappropriation Act: Report Together with Dissenting Views   (Including Cost Estimate,United States. Congress. House.,2012/06/28,,General Books LLC,9781234262495,,,,182,
1506,Database and Collections of Information Misappropriations,United States Congress House of Represen (Created by),2010/12/28,,BiblioGov,9781240485437,,,,162,
1507,Database and Data Communication Network Systems: Techniques and Applications,Cornelius T. Leondes,2002/01/01,,Elsevier Science & Technology Books,9780124438965,,,,,
1508,"Database and Data Communication Network Systems, Three-Volume Set: Techniques and Applications","Cornelius T. Leondes (Editor), Cornelius T. Leondes",2002/07/02,,Elsevier Science,9780124438958,,,,952,
1509,Database and Data Communication Systems: A Guide for Managers,Myles E. Walsh,1983/01/01,,Prentice Hall Professional Technical Reference,9780835912181,,,,273,
1510,"Database and Expert Systems Applications: 8th International Conference, DEXA'97, Toulouse, France, September 1-5, 1997, Proceedings","A. Hameurlain (Editor), A. Min Tjoa (Editor)",1997/09/19,1,Springer Berlin Heidelberg,9783540634782,,"Lecture Notes in Computer Science Series ,#1308",,694,
1511,"Database and Expert Systems Applications: Proceedings of the International Conference in Valencia, Spain, 1992","A Min Tjoa (Editor), Isidro Ramos (Editor)",1992/11/28,,Springer Vienna,9783211824009,,,,546,
1512,"Database and Expert Systems Applications: Proceedings of the International Conference in Vienna, Austria, 1990","A Min Tjoa (Editor), Roland Wagner (Editor)",1990/08/28,,Springer Vienna,9783211822340,,,,572,
1513,"Database and Expert Systems Applications: 13th International Conference, DEXA 2002, Aix-en-Provence, France, September 2-6, 2002. Proceedings","Abdelkader Hameurlain (Editor), Rosine Cicchetti (Editor), Roland Traunmueller (Editor)",2002/10/03,1,Springer Berlin Heidelberg,9783540441267,,"Lecture Notes in Computer Science Series ,#2453",,954,
1514,"Database and Expert Systems Applications: Proceedings International Workshop, Florence, Italy, 1999","Antonio Cammelli (Editor), IEEE",1999/09/28,,IEEE Computer Society Press,9780769502816,,,,1000,
1515,"Database and Expert Systems Applications: 5th International Conference, DEXA'94, Athens, Greece, September 7 - 9, 1994. Proceedings",Dimitris Karagiannis (Editor),1994/08/24,1,Springer Berlin Heidelberg,9783540584353,,"Lecture Notes in Computer Science Series ,#856",,814,
1516,"Database and Expert Systems Applications: Proceedings of the International Conference in Berlin, Federal Republic of Germany, 1991",Dimitris Karagiannis (Editor),1991/07/01,,"Springer-Verlag New York, LLC",9780387823010,,,,570,
1517,"Database and Expert Systems Applications: 15th International Conference, DEXA 2004, Zaragoza, Spain, August 30-September 3, 2004, Proceedings","Fernando Galindo (Editor), Makoto Takizawa (Editor), Roland Traunmueller (Editor)",2004/10/05,1,Springer Berlin Heidelberg,9783540229360,,"Lecture Notes in Computer Science Series ,#3180",,978,
1518,"Database and Expert Systems Applications: 9th International Conference, DEXA'98, Vienna, Austria, August 24-28, 1998, Proceedings","Gerald Quirchmayr (Editor), Erich Schweighofer (Editor), Trevor J.M. Bench-Capon (Editor)",1998/09/18,1,Springer Berlin Heidelberg,9783540649502,,"Lecture Notes in Computer Science Series ,#1460",,926,
1519,"Database and Expert Systems Applications: 12th International Conference, DEXA 2001 Munich, Germany, September 3-5, 2001 Proceedings","Heinrich C. Mayr (Editor), Jiri Lazansky (Editor), Gerald Quirchmayr (Editor), Pavel Vogel (Editor)",2001/12/12,1,Springer Berlin Heidelberg,9783540425274,,"Lecture Notes in Computer Science Series ,#2113",,994,
1520,"Database and Expert Systems Applications: 24th International Conference, DEXA 2013, Prague, Czech Republic, August 26-29, 2013. Proceedings, Part II","Hendrik Decker (Editor), Lenka Lhotska (Editor), Sebastian Link (Editor), Josef Basl (Editor), A Min Tjoa (Editor)",2013/08/08,,Springer Berlin Heidelberg,9783642401725,,"Lecture Notes in Computer Science / Information Systems and Applications, incl. Internet/Web, and HCI Series ,#8056",,501,
1521,"Database and Expert Systems Applications: 16th International Conference, DEXA 2005, Copenhagen, Denmark, August 22-26, 2005, Proceedings","Kim V. Andersen (Editor), John Debenham (Editor), Roland Wagner (Editor)",2005/09/27,1,Springer Berlin Heidelberg,9783540285663,,"Lecture Notes in Computer Science / Information Systems and Applications, incl. Internet/Web, and HCI Series ,#3588",,955,
1522,"Database and Expert Systems Applications: 11th International Conference, DEXA 2000 London, UK, September 4-8, 2000 Proceedings","Mohamed Ibrahim (Editor), Josef Kung (Editor), Norman Revell (Editor)",2000/10/02,1,Springer Berlin Heidelberg,9783540679783,,"Lecture Notes in Computer Science Series ,#1873",,1012,
1523,"Database and Expert Systems Applications: 6th International Conference, DEXA'95, London, United Kingdom, September 4 - 8, 1995, Proceedings","Norman Revell (Editor), A Min Tjoa (Editor), G. Goos (Editor), J. Hartmanis (Editor), Jan Van Leeuwen (Editor)",1995/08/23,1,Springer Berlin Heidelberg,9783540603030,,"Lecture Notes in Computer Science Series ,#978",,658,
1524,"Database and Expert Systems Applications: 21st International Conference, DEXA 2010, Bilbao, Spain, August 30 - September 3, 2010, Proceedings, Part I","Pablo Garcia Bringas (Editor), Abdelkader Hameurlain (Editor), Gerald Quirchmayr (Editor)",2011/07/14,1,Springer Berlin Heidelberg,9783642153631,,"Lecture Notes in Computer Science / Information Systems and Applications, incl. Internet/Web, and HCI Series ,#6261",,523,
1525,"Database and Expert Systems Applications: 18th International Conference, DEXA 2007, Regensburg, Germany, September 3-7, 2007, Proceedings","Roland Wagner (Editor), Norman Revell (Editor), Gunther Pernul (Editor)",2007/08/28,1,Springer Berlin Heidelberg,9783540744672,,"Lecture Notes in Computer Science / Information Systems and Applications, incl. Internet/Web, and HCI Series ,#4653",,907,
1526,"Database and Expert Systems Applications: 19th International Conference, DEXA 2008, Turin, Italy, September 1-5, 2008, Proceedings","Sourav S. Bhowmick (Editor), Josef Kung (Editor), Roland Wagner (Editor)",2008/09/28,1,Springer Berlin Heidelberg,9783540856535,,"Lecture Notes in Computer Science / Information Systems and Applications, incl. Internet/Web, and HCI Series ,#5181",,853,
1527,"Database and Expert Systems Applications: 17th International Conference, DEXA 2006, Krakow, Poland, September 4-8, 2006, Proceedings","Stephane Bressan (Editor), Josef Kung (Editor), Roland Wagner (Editor)",2006/10/05,1,Springer Berlin Heidelberg,9783540378716,,"Lecture Notes in Computer Science / Information Systems and Applications, incl. Internet/Web, and HCI Series ,#4080",,959,
1528,"Database and Expert Systems Applications: 23rd International Conference, DEXA 2012, Vienna, Austria, September 3-6, 2012, Proceedings, Part II","Stephen W. Liddle (Editor), Klaus-Dieter Schewe (Editor), A Min Tjoa (Editor), Xiaofang Zhou (Editor)",2012/07/20,1,Springer Berlin Heidelberg,9783642325960,,"Lecture Notes in Computer Science / Information Systems and Applications, incl. Internet/Web, and HCI Series ,#7447",,526,
1529,"Database and Expert Systems Applications: 10th International Conference, DEXA'99, Florence, Italy, August 30 - September 3, 1999, Proceedings","Trevor Bench-Capon (Editor), Giovanni Soda (Editor), A Min Tjoa (Editor)",1999/09/24,1,Springer Berlin Heidelberg,9783540664482,,"Lecture Notes in Computer Science Series ,#1677",,1110,
1530,"Database and Expert Systems Applications: Fourth International Conference, DEXA '93 Prague, Czech Republic, September 6-8, 1993 Proceedings","Vladimir Marik (Editor), R. R. Wagner (Editor), J. Lazansky (Editor)",1994/03/01,,"Springer-Verlag New York, LLC",9780387572345,,Lecture Notes in Computer Science,,783,
1531,Database and File Management Systems for the Microcomputer,Nelson T. Dinerstein,1985/01/01,1,Addison Wesley School,9780673180889,,,,128,
1532,Database and Interface Issues of an E-Learning Tool,Ghosh Anisha,2013/04/24,,AV Akademikerverlag GmbH & Co. KG.,9783659362392,,,,112,
1533,Database and Map of Quaternary Faults and Folds of Ecuador and its Offshore Regions: Open-File Report 2003-289,"United U.S. Department of the Interior (Created by), et al., Arturo Eguez",2013/02/06,,BiblioGov,9781288719501,,,,80,
1534,"Database and XML Technologies: 5th International XML Database Symposium, XSym 2007, Vienna, Austria, September 23-24, 2007, Proceedings","Denilson Barbosa (Editor), Angela Bonifati (Editor), Zohra Bellahsene (Editor), Ela Hunt (Editor), Rainer Unland (Editor)",2007/10/23,1,Springer Berlin Heidelberg,9783540752875,,"Lecture Notes in Computer Science / Information Systems and Applications, incl. Internet/Web, and HCI Series ,#4704",,144,
1535,"Database and XML Technologies: 7th International XML Database Symposium, XSym 2010, Singapore, September 17, 2010, Proceedings","Mong Li Lee (Editor), Jeffrey Xu Yu (Editor), Zohra Bellahsene (Editor), Rainer Unland (Editor)",2010/10/08,1,Springer Berlin Heidelberg,9783642156830,,"Lecture Notes in Computer Science / Information Systems and Applications, incl. Internet/Web, and HCI Series ,#6309",,156,
1536,"Database and XML Technologies: 4th International XML Database Symposium, XSym 2006, Seoul, Korea, September 10-11, 2006, Proceedings","Sihem Amer-Yahia (Editor), Zohra Bellahsene (Editor), Ela Hunt (Editor), Rainer Unland (Editor), Jeffrey Xu Yu (Editor)",2006/10/05,1,Springer Berlin Heidelberg,9783540388777,,"Lecture Notes in Computer Science / Information Systems and Applications, incl. Internet/Web, and HCI Series ,#4156",,123,
1537,"Database and XML Technologies: Third International XML Database Symposium, XSym 2005, Trondheim, Norway, August 28-29, 2005, Proceedings","Stephane Bressan (Editor), Stefano Ceri (Editor), Ela Hunt (Editor), Zachary G. Ives (Editor), Zohra Bellahsene (Editor)",2005/09/21,1,Springer Berlin Heidelberg,9783540285830,,"Lecture Notes in Computer Science / Information Systems and Applications, incl. Internet/Web, and HCI Series ,#3671",,239,
1538,"Database and XML Technologies: First International XML Database Symposium, XSYM 2003, Berlin, Germany, September 8, 2003, Proceedings","Zohra Bellahsene (Editor), Akmal B. Chaudhri (Editor), Erhard Rahm (Editor), Michael Rys (Editor), Rainer Unland (Editor)",2003/11/05,1,Springer Berlin Heidelberg,9783540200550,,"Lecture Notes in Computer Science Series ,#2824",,286,
1539,Database Annotation in Molecular Biology: Principles and Practice,Arthur M. Lesk (Editor),2004/01/23,1,Wiley,9780470856819,,,,266,
1540,Database Application Development and Design,Michael V. Mannino,2000/11/28,1,"McGraw-Hill Companies, The",9780073033457,,,,583,
1541,Database Application Development & Design with ERD Drawing Tool,Michael V. Mannino,2000/11/28,1,Irwin/McGraw-Hill,9780072463675,,,,583,
1542,Database Application Engineering with DAIDA,Matthias Jarke (Editor),1993/05/01,,"Springer-Verlag New York, LLC",9780387562919,,Research Reports Series,,558,
1543,Database Application,Harding Ozihel (Editor),2011/08/10,,Frac Press,9786136554747,,,,88,
1544,Database Application Programming with Linux,"Brian Jepson, Ram Sadasiv, Joan Peckham",2000/07/17,1,Wiley,9780471355496,,,,528,
1545,Database Applications: Fast Lane Video Advertising and Marketing News,Daisy L. Stewart,1990/01/28,1,McGraw-Hill Higher Education,9780070614833,,,,,
1546,Database Applications in Business: A Casebook Approach,"William E. Leigh, Clifford G. Burgess",1988/02/01,,Cengage South-Western,9780538109208,,,,640,
1547,Database Applications in Visual Basic,Chuck Butkus,1993/04/12,,"Holt, Henry & Company, Inc.",9781558282858,,,,388,
1548,Database Applications: Job-Based Tasks/Student Package Book and Disk,"Paradigm Publishing, Incorporated",1993/01/01,,EMC/Paradigm Publishing,9781561183944,,,,,
1549,Database Applications Reinforcement,Drum,1994/10/28,3,South-Western,9780538632553,,Df - Computer Applications Series,,240,
1550,Database Applications Semantics,L. Mark (Editor),1996/10/31,1,Springer US,9780412726002,,IFIP Advances in Information and Communication Technology Series,,624,
1551,Database Applications: Job-Based Tasks,"Steven B. Larson, Garry Nordenstam",1993/01/01,,Paradigm Publishers,9781561185061,,,,157,
1552,Database Applications Using dBASE IV,Jean Andrews Smith,1993/02/01,1,"Course Technology, Inc.",9780534931308,,,,453,
1553,Database Applications Using PROLOG,Robert Lucas,1988/10/01,,Prentice Hall Professional Technical Reference,9780470211663,,Ellis Horwood Books in Computing Science. Series in Computers and Their Applications,,159,
